ques_no,question,ques_template
1,Two teams play a series of games (best of 7 - whoever wins 4 games first) in which each team has a 50% chance of winning any given round (no draws allowed). What is the probability that the series goes to 7 games?,"{'description': 'Probability calculation involving a best-of-7 game series with equal team probabilities, requiring probabilistic reasoning and series outcome analysis', 'technical_concepts': {'category': 'Probability', 'primary': ['Probability Theory', 'Combinatorial Probability', 'Sports Series Probability'], 'tools': [], 'methods': ['Binomial Distribution', 'Probability Calculation']}, 'skill_level': {'depth': 'intermediate', 'knowledge_type': ['theoretical', 'analytical'], 'experience_level': 'mid'}, 'domain_context': {'industries': ['General', 'Data Science', 'Statistics', 'Game Theory']}}"
2,Say you roll a die three times. What is the probability of getting two sixes in a row?,"{'description': 'Probability calculation involving multiple independent die rolls, focusing on understanding conditional probability and sequential event probabilities', 'technical_concepts': {'category': 'Probability', 'primary': ['Conditional Probability', 'Independent Events', 'Probability Calculation'], 'tools': [], 'methods': ['Probability Multiplication', 'Event Sequencing']}, 'skill_level': {'depth': 'basic', 'knowledge_type': ['theoretical'], 'experience_level': 'junior'}, 'domain_context': {'industries': ['General']}}"
3,"You roll three dice, one after another. What is the probability that you obtain three numbers in a strictly increasing order?","{'description': 'Probability calculation involving conditional probabilities and understanding order constraints in dice roll sequences', 'technical_concepts': {'category': 'Probability', 'primary': ['Combinatorics', 'Sample Space', 'Conditional Probability', 'Ordered Events'], 'tools': [], 'methods': ['Counting Method', 'Probability Calculation']}, 'skill_level': {'depth': 'intermediate', 'knowledge_type': ['theoretical', 'mathematical'], 'experience_level': 'mid'}, 'domain_context': {'industries': ['General', 'Data Science', 'Statistics', 'Mathematics']}}"
4,"Assume you have a deck of 100 cards with values ranging from 1 to 100, and that you draw two cards at random without replacement. What is the probability that the number of one card is precisely double that of the other?","{'description': 'Probability problem involving random card selection and evaluating conditional probability constraints', 'technical_concepts': {'category': 'Probability', 'primary': ['Conditional Probability', 'Combinatorial Probability', 'Sample Space Analysis'], 'tools': [], 'methods': ['Probability Calculation', 'Set Theory', 'Counting Techniques']}, 'skill_level': {'depth': 'intermediate', 'knowledge_type': ['theoretical', 'computational'], 'experience_level': 'junior'}, 'domain_context': {'industries': ['General', 'Data Science', 'Analytics']}}"
5,"Imagine you are in a 3D space. From (0,0,0) to (3,3,3), how many paths are there if you can move only up,right, and forward?","{'description': 'Combinatorics problem involving path counting in a three-dimensional grid with restricted movement, testing spatial reasoning and mathematical problem-solving skills', 'technical_concepts': {'category': 'Probability', 'primary': ['Combinatorics', 'Path Counting', 'Spatial Mathematics'], 'tools': [], 'methods': ['Mathematical Reasoning', 'Grid Traversal']}, 'skill_level': {'depth': 'intermediate', 'knowledge_type': ['theoretical', 'mathematical'], 'experience_level': 'mid'}, 'domain_context': {'industries': ['General']}}"
6,"One in a thousand people have a particular disease, and the test for the disease is 98% correct in testing for the disease. On the other hand, the test has a 1% error rate if the person being tested does not have the disease. If someone tests positive, what are the odds they have the disease?","{'description': 'Bayesian probability problem testing understanding of conditional probability, diagnostic testing interpretation, and probabilities of false positives and false negatives', 'technical_concepts': {'category': 'Probability', 'primary': ['Conditional Probability', ""Bayes' Theorem"", 'Diagnostic Test Accuracy'], 'tools': [], 'methods': ['Probabilistic Reasoning', 'Statistical Inference']}, 'skill_level': {'depth': 'intermediate', 'knowledge_type': ['theoretical', 'practical'], 'experience_level': 'mid'}, 'domain_context': {'industries': ['Healthcare', 'Medical Diagnostics', 'Data Science']}}"
7,"Assume two coins, one fair (having one side heads and one side tails) and the other unfair (having both sides tails). You pick one at random, flip it five times, and observe that it comes up as tails all five times. What is the probability that you are flipping the unfair coin?","{'description': 'Probability problem involving conditional probability and Bayesian reasoning, testing ability to calculate probabilities with limited information and update beliefs based on observed evidence', 'technical_concepts': {'category': 'Probability', 'primary': ['Conditional Probability', 'Bayesian Inference', 'Prior and Posterior Probabilities'], 'tools': [], 'methods': [""Bayes' Theorem"", 'Probabilistic Reasoning']}, 'skill_level': {'depth': 'advanced', 'knowledge_type': ['theoretical', 'probabilistic reasoning'], 'experience_level': 'mid'}, 'domain_context': {'industries': ['General', 'Data Science', 'Statistics', 'Machine Learning']}}"
8,"Players A and B are playing a game where they take turns flipping a biased coin, with p probability of landing on heads (and winning). Player A starts the game, and then the players pass the coin back and forth until one person flips heads and wins. What is the probability that A wins?","{'description': 'Probability analysis of a two-player coin flipping game with a biased coin, determining the winning probability of the first player', 'technical_concepts': {'category': 'Probability', 'primary': ['Probabilistic Game Theory', 'Conditional Probability', 'Stochastic Processes'], 'tools': [], 'methods': ['Recursive Probability Calculation', 'State Space Analysis']}, 'skill_level': {'depth': 'advanced', 'knowledge_type': ['theoretical', 'mathematical modeling'], 'experience_level': 'mid'}, 'domain_context': {'industries': ['General', 'Game Theory', 'Statistics & Probability']}}"
9,"Three friends in Seattle each told you it is rainy, and each person has a 1/3 probability of lying. What is the probability that Seattle is rainy, assuming that the likelihood of rain on any given day is 0.25?","{'description': 'Probability calculation involving conditional probability and independent testimony from multiple sources, testing statistical reasoning and probabilistic inference', 'technical_concepts': {'category': 'Probability', 'primary': ['Conditional Probability', 'Independent Events', 'Bayesian Inference'], 'tools': [], 'methods': ['Probability Tree', ""Bayes' Theorem""]}, 'skill_level': {'depth': 'intermediate', 'knowledge_type': ['theoretical', 'probabilistic reasoning'], 'experience_level': 'junior'}, 'domain_context': {'industries': ['General', 'Data Science', 'Statistics', 'Research']}}"
10,You draw a circle and choose two chords at random. What is the probability that those chords will intersect?,"{'description': 'Probability calculation involving random chord intersections in a circle, testing geometric probability and probabilistic reasoning skills', 'technical_concepts': {'category': 'Probability', 'primary': ['Geometric Probability', 'Random Chord Selection', 'Circle Geometry'], 'tools': [], 'methods': ['Probabilistic Reasoning', 'Statistical Calculation']}, 'skill_level': {'depth': 'advanced', 'knowledge_type': ['theoretical', 'mathematical'], 'experience_level': 'mid'}, 'domain_context': {'industries': ['Mathematics', 'General']}}"
11,"You and your friend are playing a game. The two of you will continue to toss a coin until the sequence HH or TH shows up. If HH shows up first, you win. If TH shows up first, your friend wins. What is the probability of you winning?","{'description': 'Probability problem involving coin tossing and sequence probability, testing understanding of probabilistic reasoning and game theory concepts', 'technical_concepts': {'category': 'Probability', 'primary': ['Sequence Probability', 'Conditional Probability', 'Random Walk', 'Stochastic Processes'], 'tools': [], 'methods': ['State Space Analysis', 'Probability Tree', 'Markov Chain Reasoning']}, 'skill_level': {'depth': 'intermediate', 'knowledge_type': ['theoretical', 'analytical'], 'experience_level': 'junior'}, 'domain_context': {'industries': ['General', 'Data Science', 'Statistics']}}"
12,Say you are playing a game where you roll a 6-sided die up to two times and can choose to stop following the first roll if you wish. You will receive a dollar amount equal to the final amount rolled. How much are you willing to pay to play this game?,"{'description': 'Probabilistic decision-making problem involving risk assessment and expected value calculation with multiple roll options', 'technical_concepts': {'category': 'Probability', 'primary': ['Expected Value', 'Decision Theory', 'Probability Calculation', 'Risk Assessment'], 'tools': [], 'methods': ['Conditional Probability', 'Bayesian Reasoning']}, 'skill_level': {'depth': 'intermediate', 'knowledge_type': ['theoretical', 'practical'], 'experience_level': 'mid'}, 'domain_context': {'industries': ['Finance', 'Risk Management', 'General']}}"
13,"Facebook has a content team that labels pieces of content on the platform as either spam or not spam. 90% of them are diligent raters and will mark 20% of the content as spam and 80% as non-spam. The remaining 10% are not diligent raters and will mark 0% of the content as spam and 100% as non-spam. Assume the pieces of content are labeled independently of one another, for every rater. Given that a rater has labeled four pieces of content as good, what is the probability that this rater is a diligent rater?","{'description': 'Bayesian probabilistic inference problem involving content labeling and rater classification using prior probabilities and conditional probabilities', 'technical_concepts': {'category': 'Probability', 'primary': ['Bayesian inference', 'Conditional probability', 'Prior and posterior probabilities'], 'tools': [], 'methods': [""Bayes' theorem"", 'Probabilistic classification']}, 'skill_level': {'depth': 'intermediate', 'knowledge_type': ['theoretical', 'probabilistic reasoning'], 'experience_level': 'mid'}, 'domain_context': {'industries': ['Social Media', 'Content Moderation', 'Machine Learning']}}"
14,A couple has two children. You discover that one of their children is a boy. What is the probability that the second child is also a boy?,"{'description': 'Probability reasoning about gender distribution in a two-child family, testing understanding of conditional probability and probabilistic reasoning', 'technical_concepts': {'category': 'Probability', 'primary': ['Conditional Probability', 'Sample Space', 'Probability Distributions'], 'tools': [], 'methods': ['Bayesian Reasoning', 'Probability Calculation']}, 'skill_level': {'depth': 'basic', 'knowledge_type': ['theoretical'], 'experience_level': 'junior'}, 'domain_context': {'industries': ['General']}}"
15,A desk has eight drawers. There is a probability of 1/2 that someone placed a letter in one of the desk's eight drawers and a probability of 1/2 that this person did not place a letter in any of the desk's eight drawers. You open the first 7 drawers and find that they are all empty. What is the probability that the 8th drawer has a letter in it?,"{'description': 'Probability problem testing conditional probability and probabilistic reasoning skills, focusing on understanding probability distribution and updating probabilities based on new information', 'technical_concepts': {'category': 'Probability', 'primary': ['Conditional Probability', ""Bayes' Theorem"", 'Probability Distribution'], 'tools': [], 'methods': ['Probability Calculation', 'Probabilistic Reasoning']}, 'skill_level': {'depth': 'intermediate', 'knowledge_type': ['theoretical', 'practical'], 'experience_level': 'junior'}, 'domain_context': {'industries': ['General']}}"
16,"Two players are playing in a tennis match, and are at deuce (that is, they will playback and forth until one person has scored two more points than the other). The first player has a 60% chance of winning every point, and the second player has a 40% chance of winning every point. What is the probability that the first player wins the match?","{'description': 'Probabilistic problem solving involving game theory and statistical analysis of match outcomes based on individual point win probabilities', 'technical_concepts': {'category': 'Probability', 'primary': ['Conditional Probability', 'Binomial Distribution', 'Stochastic Processes'], 'tools': [], 'methods': ['Probability Calculation', 'State Transition Analysis']}, 'skill_level': {'depth': 'intermediate', 'knowledge_type': ['theoretical', 'statistical'], 'experience_level': 'mid'}, 'domain_context': {'industries': ['Sports Analytics', 'Gaming', 'Probability Theory']}}"
17,"Say you have a deck of 50 cards made up of cards in 5 different colors, with 10 cards of each color, numbered 1 through 10. What is the probability that two cards you pick at random do not have the same color and are also not the same number?","{'description': 'Probability problem testing understanding of combinatorial counting and probability calculation in a constrained random selection scenario', 'technical_concepts': {'category': 'Probability', 'primary': ['Combinatorial probability', 'Random sampling', 'Event calculation'], 'tools': [], 'methods': ['Total possible outcomes calculation', 'Favorable outcomes calculation']}, 'skill_level': {'depth': 'intermediate', 'knowledge_type': ['theoretical', 'practical'], 'experience_level': 'junior'}, 'domain_context': {'industries': ['General', 'Data Science', 'Statistics']}}"
18,"Suppose you have ten fair dice. If you randomly throw these dice simultaneously, what is the probability that the sum of all the top faces is divisible by 6?","{'description': 'Probability problem involving multiple dice, testing understanding of combinatorics, probability calculation, and divisibility conditions', 'technical_concepts': {'category': 'Probability', 'primary': ['Probability Calculation', 'Combinatorics', 'Discrete Random Variables', 'Divisibility Rules'], 'tools': [], 'methods': ['Counting Method', 'Probability Distribution Analysis']}, 'skill_level': {'depth': 'intermediate', 'knowledge_type': ['theoretical', 'computational'], 'experience_level': 'mid'}, 'domain_context': {'industries': ['General', 'Data Science', 'Statistics', 'Research']}}"
19,"A and B play the following game: a number k from 1-6 is chosen, and A and B will toss a die until the first person throws a die showing side k, after which that person is awarded $100 and the game is over. How much is A willing to pay to play first in this game?","{'description': 'Probability and game theory problem analyzing the strategic advantage of going first in a probabilistic game with specific win conditions', 'technical_concepts': {'category': 'Probability', 'primary': ['Probability Calculation', 'Expected Value', 'Game Theory', 'Conditional Probability'], 'tools': [], 'methods': ['Probability Distribution', 'Decision Theory', 'Expected Utility Calculation']}, 'skill_level': {'depth': 'advanced', 'knowledge_type': ['theoretical', 'analytical'], 'experience_level': 'mid'}, 'domain_context': {'industries': ['General', 'Data Science', 'Economics', 'Mathematics']}}"
20,You are given an unfair coin having an unknown bias towards heads or tails. How can you generate fair odds using this coin?,"{'description': 'Solving probabilistic problem of generating fair coin toss outcomes from a biased coin through probabilistic transformation technique', 'technical_concepts': {'category': 'Probability', 'primary': ['Probability transformation', 'Random sampling', 'Statistical randomness'], 'tools': [], 'methods': ['Von Neumann method', 'Coin flipping algorithm']}, 'skill_level': {'depth': 'intermediate', 'knowledge_type': ['theoretical', 'implementation'], 'experience_level': 'junior'}, 'domain_context': {'industries': ['General', 'Data Science', 'Statistics', 'Computer Science']}}"
21,"Suppose you are given a white cube that is broken into 3x3x3=27 pieces. However, before the cube was broken, all 6 of its faces were painted green. You randomly pick a small cube and see that 5 faces are white. What is the probability that the bottom face is also white?","{'description': 'A probability problem involving a colored cube, testing spatial reasoning, geometric understanding, and systematic probability calculation', 'technical_concepts': {'category': 'Probability', 'primary': ['Geometric Probability', 'Combinatorial Analysis', 'Spatial Reasoning'], 'tools': [], 'methods': ['Conditional Probability', 'Sample Space Analysis']}, 'skill_level': {'depth': 'intermediate', 'knowledge_type': ['theoretical', 'analytical'], 'experience_level': 'mid'}, 'domain_context': {'industries': ['General', 'Data Science', 'Statistics']}}"
22,Assume you take a stick of length 1 and you break it uniformly at random into three parts. What is the probability that the three pieces can be used to form a triangle?,"{'description': 'Probability problem involving geometric constraints of triangle formation based on random stick breaking', 'technical_concepts': {'category': 'Probability', 'primary': ['Geometric Probability', 'Triangle Inequality Theorem', 'Random Segmentation'], 'tools': [], 'methods': ['Geometric Probability Calculation', 'Constraint Validation']}, 'skill_level': {'depth': 'intermediate', 'knowledge_type': ['theoretical', 'mathematical reasoning'], 'experience_level': 'mid'}, 'domain_context': {'industries': ['General', 'Mathematical Research', 'Theoretical Probability']}}"
23,"What is the probability that, in a random sequence of H's and T's, HHT shows up before HTT?","{'description': 'Probability problem involving sequence occurrence in a random coin flip scenario, testing understanding of probabilistic reasoning and sequence analysis', 'technical_concepts': {'category': 'Probability', 'primary': ['Random Sequence Probability', 'Sequential Event Probability'], 'tools': [], 'methods': ['Probability Calculation', 'Sample Space Analysis']}, 'skill_level': {'depth': 'intermediate', 'knowledge_type': ['theoretical', 'analytical'], 'experience_level': 'mid'}, 'domain_context': {'industries': ['General']}}"
24,"A fair coin is tossed twice, and you are asked to decide whether it is more likely that two heads showed up given that either (a) at least one toss was heads, or (b) the second toss was a head. Does your answer change if you are told that the coin is unfair?","{'description': 'Probability reasoning problem involving conditional probability and understanding of probabilistic events and dependencies', 'technical_concepts': {'category': 'Probability', 'primary': ['Conditional Probability', 'Sample Space', 'Event Probability', 'Probabilistic Reasoning'], 'tools': [], 'methods': ['Bayesian Reasoning', 'Probability Calculation', 'Event Composition Analysis']}, 'skill_level': {'depth': 'intermediate', 'knowledge_type': ['theoretical', 'analytical'], 'experience_level': 'mid'}, 'domain_context': {'industries': ['Data Science', 'Statistics', 'Research', 'General']}}"
25,"Three ants are sitting at the corners of an equilateral triangle. Each ant randomly picks a direction and begins moving along an edge of the triangle. What is the probability that none of the ants meet? What would your answer be if there are, instead, k ants sitting on all k corners of an equilateral polygon?","{'description': 'Probabilistic problem involving random movement of ants on a geometric shape, testing understanding of probability calculation, combinatorial reasoning, and geometric symmetry', 'technical_concepts': {'category': 'Probability', 'primary': ['Probability Theory', 'Combinatorics', 'Random Walk', 'Geometric Probability'], 'tools': [], 'methods': ['Sample Space Analysis', 'Probability Calculation', 'Symmetry-based Reasoning']}, 'skill_level': {'depth': 'intermediate', 'knowledge_type': ['theoretical', 'analytical'], 'experience_level': 'mid'}, 'domain_context': {'industries': ['General', 'Mathematics', 'Computer Science']}}"
26,"A biased coin, with probability p of landing on heads, is tossed n times. Write a recurrence relation for the probability that the total number of heads after n tosses is even.","{'description': 'Probability problem analyzing recursive probability calculation for biased coin tosses with an even heads outcome', 'technical_concepts': {'category': 'Probability', 'primary': ['Probability Theory', 'Recurrence Relations', 'Random Processes', 'Binomial Probability'], 'tools': [], 'methods': ['Dynamic Programming', 'Recursive Probability Calculation']}, 'skill_level': {'depth': 'advanced', 'knowledge_type': ['theoretical', 'implementation'], 'experience_level': 'senior'}, 'domain_context': {'industries': ['General', 'Data Science', 'Analytics', 'Research']}}"
27,Alice and Bob are playing a game together. They play a series of rounds until one of them wins two more rounds than the other. Alice wins a round with probability p. What is the probability that Bob wins the overall series?,"{'description': 'Probabilistic analysis of a multi-round game with win condition based on relative round wins between two players', 'technical_concepts': {'category': 'Probability', 'primary': ['Probability Theory', 'Stochastic Processes', 'Game Theory'], 'tools': [], 'methods': ['Binomial Distribution', 'Cumulative Probability Calculation']}, 'skill_level': {'depth': 'intermediate', 'knowledge_type': ['theoretical', 'mathematical'], 'experience_level': 'mid'}, 'domain_context': {'industries': ['General', 'Gaming', 'Statistical Analysis']}}"
28,"Say you have three draws of a uniformly distributed random variable between (0,2). What is the probability that the median of the three is greater than 1.5?","{'description': 'Probability problem involving finding the probability where the median of three uniform random variables falls above a specific threshold', 'technical_concepts': {'category': 'Probability', 'primary': ['Uniform distribution', 'Order statistics', 'Median calculation'], 'tools': [], 'methods': ['Probability calculation', 'Distribution analysis']}, 'skill_level': {'depth': 'intermediate', 'knowledge_type': ['theoretical', 'statistical'], 'experience_level': 'mid'}, 'domain_context': {'industries': ['General', 'Data Science', 'Statistics']}}"
29,"Say you have 150 friends, and 3 of them have phone numbers that have the last four digits with some permutation of the digits 0, 1, 4, and 9. What's the probability of this occuring?","{'description': 'Probability problem analyzing the likelihood of specific digit patterns in phone numbers across a friend group', 'technical_concepts': {'category': 'Probability', 'primary': ['Combinatorics', 'Probability Calculation', 'Permutation Analysis'], 'tools': [], 'methods': ['Permutation Counting', 'Probability Estimation']}, 'skill_level': {'depth': 'intermediate', 'knowledge_type': ['theoretical', 'calculation'], 'experience_level': 'junior'}, 'domain_context': {'industries': ['General']}}"
30,"A fair die is rolled n times. What is the probability that the largest number rolled is r, for each r in 1,...,6?","{'description': 'Probability calculation involving the distribution of maximum values in multiple die rolls, testing probabilistic reasoning and statistical analysis skills', 'technical_concepts': {'category': 'Probability', 'primary': ['Probability Distribution', 'Event Probability', 'Maximum Value Calculation'], 'tools': [], 'methods': ['Cumulative Probability', 'Combinatorial Analysis']}, 'skill_level': {'depth': 'intermediate', 'knowledge_type': ['theoretical', 'probabilistic reasoning'], 'experience_level': 'mid'}, 'domain_context': {'industries': ['Data Science', 'Statistics', 'Research']}}"
31,"Say you have a jar initially containing a single amoeba in it. Once every minute, the amoeba has a 1 in 4 chance of doing one of four things: (1) dying out, (2) doing nothing,(3) splitting into two amoebas, or (4) splitting into three amoebas. What is the probability that the jar will eventually contain no living amoeba?","{'description': 'Probabilistic analysis of a stochastic process involving amoeba population dynamics, requiring understanding of probability theory and random processes', 'technical_concepts': {'category': 'Probability', 'primary': ['Stochastic Processes', 'Branching Processes', 'Probability Distribution', 'Extinction Probability'], 'tools': [], 'methods': ['Markov Chain Analysis', 'Probability Calculation', 'Recursive Probability Estimation']}, 'skill_level': {'depth': 'advanced', 'knowledge_type': ['theoretical', 'mathematical'], 'experience_level': 'senior'}, 'domain_context': {'industries': ['Academic Research', 'Statistical Modeling', 'Theoretical Mathematics']}}"
32,"A fair coin is tossed n times. Given that there were k heads in the n tosses, what is the probability that the first toss was heads?","{'description': 'Conditional probability problem involving coin toss outcomes and Bayesian probability reasoning', 'technical_concepts': {'category': 'Probability', 'primary': ['Conditional Probability', 'Binomial Distribution', 'Probabilistic Reasoning'], 'tools': [], 'methods': [""Bayes' Theorem"", 'Probability Calculation']}, 'skill_level': {'depth': 'intermediate', 'knowledge_type': ['theoretical', 'probabilistic reasoning'], 'experience_level': 'mid'}, 'domain_context': {'industries': ['General', 'Data Science', 'Statistics']}}"
