ques_no,question,ques_template
68,Describe what a moment generating function (MGF) is. Derive the MGF for a normally distributed random variable X.,"{'description': 'Testing advanced probability and statistical theory understanding, focusing on moment generating functions and their mathematical derivation for normal distributions', 'technical_concepts': {'category': 'Probability', 'primary': ['Moment Generating Functions', 'Probability Theory', 'Random Variables', 'Probability Distributions'], 'tools': [], 'methods': ['Mathematical Derivation', 'Probability Distribution Characterization']}, 'skill_level': {'depth': 'advanced', 'knowledge_type': ['theoretical', 'mathematical'], 'experience_level': 'senior'}, 'domain_context': {'industries': ['Data Science', 'Statistics', 'Machine Learning', 'Academic Research']}}"
69,Say you have N independent and identically distributed draws of an exponential random variable. What is the best estimator for the parameter λ?,"{'description': 'Analyzing statistical estimation techniques for exponential distribution parameter using maximum likelihood estimation', 'technical_concepts': {'category': 'Statistics', 'primary': ['Probability theory', 'Statistical estimation', 'Maximum likelihood estimation', 'Parameter inference'], 'tools': [], 'methods': ['Maximum Likelihood Estimation (MLE)', 'Maximum Likelihood Method']}, 'skill_level': {'depth': 'advanced', 'knowledge_type': ['theoretical', 'statistical inference'], 'experience_level': 'senior'}, 'domain_context': {'industries': ['Data Science', 'Statistical Research', 'Machine Learning', 'Scientific Computing']}}"
70,"Assume that log X ~ N(0, 1). What is the expectation of X?","{'description': 'Testing understanding of logarithmic transformations and probability distributions, specifically the lognormal distribution and its properties', 'technical_concepts': {'category': 'Probability', 'primary': ['Logarithmic transformation', 'Normal distribution', 'Expectation calculation', 'Probability theory'], 'tools': [], 'methods': ['Moment calculations', 'Distribution property analysis']}, 'skill_level': {'depth': 'intermediate', 'knowledge_type': ['theoretical', 'mathematical'], 'experience_level': 'mid'}, 'domain_context': {'industries': ['Data Science', 'Statistics', 'Research', 'General']}}"
71,Say you have two distinct subsets of a dataset for which you know their means and standard deviations. How do you calculate the blended mean and standard deviation of the total dataset? Can you extend it to K subsets?,"{'description': 'Analyzing statistical methods for combining means and standard deviations from multiple subsets of data, focusing on aggregation techniques and statistical inference', 'technical_concepts': {'category': 'Statistics', 'primary': ['Data Aggregation', 'Statistical Inference', 'Weighted Averaging', 'Variance Calculation'], 'tools': [], 'methods': ['Pooled Mean Calculation', 'Combined Standard Deviation Estimation', 'Generalized Dataset Merging']}, 'skill_level': {'depth': 'intermediate', 'knowledge_type': ['theoretical', 'computational'], 'experience_level': 'mid'}, 'domain_context': {'industries': ['Data Science', 'Research', 'Analytics', 'General']}}"
72,Say we have two random variables X and Y. What does it mean for X and Y to be independent? What about uncorrelated? Give an example where X and Y are uncorrelated but not independent.,"{'description': 'Analysis of statistical relationship between random variables, focusing on independence and correlation concepts', 'technical_concepts': {'category': 'Statistics', 'primary': ['Random Variables', 'Statistical Independence', 'Correlation', 'Probabilistic Relationships'], 'tools': [], 'methods': ['Statistical Dependency Testing', 'Probabilistic Reasoning']}, 'skill_level': {'depth': 'intermediate', 'knowledge_type': ['theoretical', 'conceptual'], 'experience_level': 'mid'}, 'domain_context': {'industries': ['General', 'Data Science', 'Statistics', 'Machine Learning']}}"
73,"Say we have X ~ Uniform(-1, 1) and Y = X^2. What is the covariance of X and Y?","{'description': 'Probability problem testing understanding of random variables, transformations, covariance calculation, and statistical probability concepts', 'technical_concepts': {'category': 'Probability', 'primary': ['Random Variables', 'Uniform Distribution', 'Variable Transformation', 'Covariance Calculation'], 'tools': [], 'methods': ['Expectation Calculation', 'Statistical Moments Analysis']}, 'skill_level': {'depth': 'intermediate', 'knowledge_type': ['theoretical', 'mathematical'], 'experience_level': 'mid'}, 'domain_context': {'industries': ['Data Science', 'Statistics', 'Machine Learning']}}"
74,How do you uniformly sample points at random from a circle with radius R?,"{'description': 'Mathematical problem solving involving random sampling techniques and understanding of geometric principles', 'technical_concepts': {'category': 'Probability', 'primary': ['Uniform Random Sampling', 'Geometric Sampling', 'Probability Distribution'], 'tools': [], 'methods': ['Polar Coordinate Transformation', 'Rejection Sampling']}, 'skill_level': {'depth': 'intermediate', 'knowledge_type': ['theoretical', 'practical'], 'experience_level': 'mid'}, 'domain_context': {'industries': ['General', 'Data Science', 'Computer Graphics', 'Simulation']}}"
75,"Say you continually sample from some i.i.d. uniformly distributed (0, 1) random variables until the sum of the variables exceeds 1. How many samples do you expect to make?","{'description': 'Probabilistic problem involving sampling from a uniform distribution and understanding expected number of trials until a cumulative threshold is reached', 'technical_concepts': {'category': 'Probability', 'primary': ['Random Variables', 'Expected Value', 'Cumulative Distribution', 'Stopping Time'], 'tools': [], 'methods': ['Uniform Distribution Sampling', 'Expectation Calculation']}, 'skill_level': {'depth': 'intermediate', 'knowledge_type': ['theoretical', 'mathematical'], 'experience_level': 'mid'}, 'domain_context': {'industries': ['General']}}"
76,"Say you are building a binary classifier for an unbalanced dataset (where one class is much rarer than the other, say 1% and 99%, respectively). How do you handle this situation?","{'description': 'Analyzing approaches to handle class imbalance in machine learning classification problems, focusing on techniques to improve model performance when target classes are highly skewed', 'technical_concepts': {'category': 'Machine Learning', 'primary': ['Classification', 'Model Performance', 'Dataset Balancing', 'Model Training Strategies'], 'tools': [], 'methods': ['Resampling', 'Class Weighting', 'Synthetic Data Generation', 'Evaluation Metrics Adjustment']}, 'skill_level': {'depth': 'intermediate', 'knowledge_type': ['theoretical', 'practical', 'implementation'], 'experience_level': 'mid'}, 'domain_context': {'industries': ['Data Science', 'Machine Learning', 'General']}}"
77,What are some differences you would expect in a model that minimizes squared error versus a model that minimizes absolute error? In which cases would each error metric be appropriate?,"{'description': 'Evaluating understanding of error metrics in statistical modeling and their implications for model performance and selection', 'technical_concepts': {'category': 'Statistics', 'primary': ['Error Metrics', 'Loss Functions', 'Model Evaluation', 'Regression Analysis'], 'tools': [], 'methods': ['Mean Squared Error (MSE)', 'Mean Absolute Error (MAE)']}, 'skill_level': {'depth': 'intermediate', 'knowledge_type': ['theoretical', 'comparative analysis'], 'experience_level': 'mid'}, 'domain_context': {'industries': ['Machine Learning', 'Data Science', 'Statistical Research']}}"
78,"When performing K-means clustering, how do you choose k?","{'description': 'Selecting the optimal number of clusters in K-means clustering, understanding evaluation techniques and implications of cluster initialization', 'technical_concepts': {'category': 'Machine Learning', 'primary': ['Clustering', 'Hyperparameter Selection', 'Model Evaluation'], 'tools': ['K-means Algorithm'], 'methods': ['Elbow Method', 'Silhouette Analysis', 'Gap Statistic', 'Cross-validation']}, 'skill_level': {'depth': 'intermediate', 'knowledge_type': ['theoretical', 'practical'], 'experience_level': 'mid'}, 'domain_context': {'industries': ['Data Science', 'Machine Learning', 'Analytics', 'General']}}"
79,How can you make your models more robust to outliers?,"{'description': 'Assessing understanding of model robustness and techniques for handling extreme or anomalous data points in statistical and machine learning modeling', 'technical_concepts': {'category': 'Machine Learning', 'primary': ['Model Robustness', 'Outlier Detection', 'Statistical Variance'], 'tools': [], 'methods': ['Regularization', 'Robust Regression', 'Winsorization', 'Cross-validation']}, 'skill_level': {'depth': 'intermediate', 'knowledge_type': ['theoretical', 'practical'], 'experience_level': 'mid'}, 'domain_context': {'industries': ['Data Science', 'Machine Learning', 'Statistical Analysis']}}"
80,Say that you are running a multiple linear regression and that you have reason to believe that several of the predictors are correlated. How will the results of the regression be affected if several are indeed correlated? How would you deal with this problem?,"{'description': 'Understanding multicollinearity in multiple linear regression, its implications on model performance, and strategies for addressing correlated predictors', 'technical_concepts': {'category': 'Statistics', 'primary': ['Multicollinearity', 'Multiple Linear Regression', 'Predictor Correlation', 'Model Interpretation'], 'tools': [], 'methods': ['Variance Inflation Factor (VIF)', 'Ridge Regression', 'Lasso Regression', 'Principal Component Analysis (PCA)']}, 'skill_level': {'depth': 'intermediate', 'knowledge_type': ['theoretical', 'practical', 'implementation'], 'experience_level': 'mid'}, 'domain_context': {'industries': ['Data Science', 'Statistical Analysis', 'Machine Learning', 'General']}}"
81,Describe the motivation behind random forests. What are two ways in which they improve upon individual decision trees?,"{'description': 'Understanding the rationale and key improvements of random forest ensemble learning technique in machine learning classification and regression problems', 'technical_concepts': {'category': 'Machine Learning', 'primary': ['Ensemble Learning', 'Decision Trees', 'Model Variance Reduction', 'Feature Randomization'], 'tools': ['Random Forest Algorithm'], 'methods': ['Bagging (Bootstrap Aggregating)', 'Feature Subsampling']}, 'skill_level': {'depth': 'intermediate', 'knowledge_type': ['theoretical', 'design'], 'experience_level': 'mid'}, 'domain_context': {'industries': ['General']}}"
82,"Given a large dataset of payment transactions, say we want to predict the likelihood of a given transaction being fraudulent. However, there are many rows with missing values for various columns. How would you deal with this?","{'description': 'Handling missing data in a fraud detection machine learning context, demonstrating data preprocessing and feature engineering skills for predictive modeling', 'technical_concepts': {'category': 'Machine Learning', 'primary': ['Data Preprocessing', 'Feature Engineering', 'Missing Data Handling', 'Fraud Detection'], 'tools': ['Pandas', 'NumPy', 'Scikit-learn'], 'methods': ['Imputation', 'Missing Value Analysis', 'Machine Learning Classification']}, 'skill_level': {'depth': 'intermediate', 'knowledge_type': ['practical', 'implementation', 'theoretical'], 'experience_level': 'mid'}, 'domain_context': {'industries': ['Finance', 'Banking', 'Payment Systems', 'Cybersecurity']}}"
83,"Say you are running a simple logistic regression to solve a problem but find the results to be unsatisfactory. What are some ways you might improve your model, or what other models might you look into using instead?","{'description': 'Evaluating model performance, understanding limitations of logistic regression, and exploring alternative modeling approaches', 'technical_concepts': {'category': 'Machine Learning', 'primary': ['Logistic Regression', 'Model Performance Optimization', 'Model Selection'], 'tools': [], 'methods': ['Feature Engineering', 'Regularization', 'Hyperparameter Tuning', 'Cross-Validation']}, 'skill_level': {'depth': 'intermediate', 'knowledge_type': ['theoretical', 'practical', 'implementation'], 'experience_level': 'mid'}, 'domain_context': {'industries': ['General']}}"
84,Say you were running a linear regression for a dataset but you accidentally duplicated every data point. What happens to your beta coefficient?,"{'description': 'Assessment of understanding linear regression mechanics, statistical sensitivity, and fundamental regression analysis principles', 'technical_concepts': {'category': 'Statistics', 'primary': ['Linear Regression', 'Regression Coefficients', 'Statistical Data Properties'], 'tools': [], 'methods': ['Ordinary Least Squares (OLS)']}, 'skill_level': {'depth': 'intermediate', 'knowledge_type': ['theoretical', 'implementation'], 'experience_level': 'junior/mid'}, 'domain_context': {'industries': ['General', 'Data Science', 'Machine Learning', 'Statistical Analysis']}}"
85,Compare and contrast gradient boosting and random forests.,"{'description': 'Comparative analysis of advanced ensemble machine learning algorithms, evaluating their architectural differences, strengths, and use cases', 'technical_concepts': {'category': 'Machine Learning', 'primary': ['Ensemble Learning', 'Decision Tree Algorithms', 'Model Optimization', 'Predictive Modeling'], 'tools': ['Scikit-learn', 'XGBoost', 'LightGBM'], 'methods': ['Gradient Boosting', 'Random Forest', 'Ensemble Training', 'Tree-based Learning']}, 'skill_level': {'depth': 'advanced', 'knowledge_type': ['theoretical', 'implementation', 'design'], 'experience_level': 'senior'}, 'domain_context': {'industries': ['Data Science', 'Machine Learning', 'AI Research', 'General']}}"
86,"Say that DoorDash is launching in Singapore. For this new market, you want to predict the estimated time of arrival (ETA) for a delivery to reach a customer after an order has been placed on the app. From an earlier beta test in Singapore, there were 10,000 deliveries made. Do you have enough training data to create an accurate ETA model?","{'description': 'Evaluate data sufficiency and model development strategy for predictive ETA modeling in a new market launch scenario', 'technical_concepts': {'category': 'Machine Learning', 'primary': ['Predictive Modeling', 'Data Sufficiency Analysis', 'Market Entry Strategy', 'Sample Size Estimation'], 'tools': ['Machine Learning Modeling', 'Statistical Analysis'], 'methods': ['Predictive Modeling', 'Statistical Inference', 'Sample Size Validation']}, 'skill_level': {'depth': 'advanced', 'knowledge_type': ['theoretical', 'practical', 'implementation'], 'experience_level': 'senior'}, 'domain_context': {'industries': ['Food Delivery', 'Transportation', 'E-commerce Logistics']}}"
87,"Say we are running a binary classification loan model, and rejected applicants must be supplied with a reason why they were rejected. Without digging into the weights of features, how would you supply these reasons?","{'description': 'Exploring interpretability and explanation strategies for machine learning classification models, focusing on providing transparent and meaningful rejection reasons', 'technical_concepts': {'category': 'Machine Learning', 'primary': ['Model Interpretability', 'Binary Classification', 'Feature Importance', 'Model Explainability'], 'tools': ['SHAP', 'LIME', 'Decision Trees'], 'methods': ['Feature Attribution', 'Local Interpretable Model-agnostic Explanations', 'Partial Dependency Plots']}, 'skill_level': {'depth': 'intermediate', 'knowledge_type': ['practical', 'design', 'implementation'], 'experience_level': 'mid'}, 'domain_context': {'industries': ['Financial Services', 'Banking', 'Credit Risk Assessment']}}"
88,Say you are given a very large corpus of words. How would you identify synonyms?,"{'description': 'Exploring techniques for identifying synonyms in large word corpora, focusing on natural language processing and semantic analysis approaches', 'technical_concepts': {'category': 'Natural Language Processing', 'primary': ['Synonym Detection', 'Semantic Similarity', 'Word Embeddings', 'Distributional Semantics'], 'tools': ['Word2Vec', 'GloVe', 'FastText'], 'methods': ['Distributional Similarity', 'Vector Space Model', 'Cosine Similarity', 'Contextual Word Embedding']}, 'skill_level': {'depth': 'advanced', 'knowledge_type': ['theoretical', 'implementation', 'design'], 'experience_level': 'mid/senior'}, 'domain_context': {'industries': ['Technology', 'Natural Language Processing', 'Machine Learning', 'Data Science']}}"
89,What is the bias-variance trade-off? How is it expressed using an equation?,"{'description': 'Understanding the fundamental statistical learning concept of bias-variance trade-off, involving model complexity, prediction error, and model performance optimization', 'technical_concepts': {'category': 'Statistics', 'primary': ['Model Complexity', 'Prediction Error', 'Machine Learning Model Performance', 'Generalization'], 'tools': [], 'methods': ['Bias-Variance Decomposition', 'Error Analysis']}, 'skill_level': {'depth': 'intermediate', 'knowledge_type': ['theoretical', 'conceptual'], 'experience_level': 'mid'}, 'domain_context': {'industries': ['Machine Learning', 'Data Science', 'Statistical Learning']}}"
90,Define the cross-validation process.What is the motivation behind using it?,"{'description': 'An assessment of understanding cross-validation as a statistical technique for model evaluation and validation, testing model performance generalization and robustness', 'technical_concepts': {'category': 'Statistics', 'primary': ['Model Evaluation', 'Statistical Validation', 'Machine Learning Model Performance'], 'tools': [], 'methods': ['Cross-Validation', 'K-Fold Cross-Validation', 'Train-Test Split']}, 'skill_level': {'depth': 'intermediate', 'knowledge_type': ['theoretical', 'practical'], 'experience_level': 'mid'}, 'domain_context': {'industries': ['Machine Learning', 'Data Science', 'Statistical Analysis']}}"
91,How would you build a lead scoring algorithm to predict whether a prospective company is likely to convert into being an enterprise customer?,"{'description': 'Developing a predictive algorithm to assess potential enterprise customer conversion probability using data-driven lead scoring techniques', 'technical_concepts': {'category': 'Machine Learning', 'primary': ['Predictive Modeling', 'Lead Scoring', 'Customer Conversion Prediction', 'Data Feature Engineering'], 'tools': ['Supervised Machine Learning Algorithms', 'Statistical Modeling'], 'methods': ['Logistic Regression', 'Decision Trees', 'Random Forest', 'Gradient Boosting']}, 'skill_level': {'depth': 'advanced', 'knowledge_type': ['theoretical', 'practical', 'implementation', 'design'], 'experience_level': 'senior'}, 'domain_context': {'industries': ['Sales', 'Business Development', 'Enterprise Software', 'B2B Marketing']}}"
92,How would you approach creating a music recommendation algorithm?,"{'description': 'Design a music recommendation system exploring algorithmic approaches, machine learning techniques, and understanding of user preference modeling', 'technical_concepts': {'category': 'Machine Learning', 'primary': ['Recommendation Systems', 'Collaborative Filtering', 'Content-Based Filtering', 'User Preference Modeling'], 'tools': ['Pandas', 'NumPy', 'Scikit-learn'], 'methods': ['Matrix Factorization', 'Cosine Similarity', 'Clustering', 'Regression Models']}, 'skill_level': {'depth': 'intermediate', 'knowledge_type': ['theoretical', 'design', 'implementation'], 'experience_level': 'mid'}, 'domain_context': {'industries': ['Entertainment', 'Media', 'Technology']}}"
93,Define what it means for a function to be convex. What is an example of a machine learning algorithm that is not convex and describe why that is so?,"{'description': 'Assessment of mathematical understanding of convex functions and their implications in machine learning algorithm design, focusing on optimization challenges', 'technical_concepts': {'category': 'Machine Learning', 'primary': ['Convex Functions', 'Optimization Theory', 'Mathematical Properties of Algorithms'], 'tools': [], 'methods': ['Gradient Descent', 'Optimization Algorithms']}, 'skill_level': {'depth': 'advanced', 'knowledge_type': ['theoretical', 'implementation'], 'experience_level': 'mid/senior'}, 'domain_context': {'industries': ['Machine Learning', 'Data Science', 'Mathematical Modeling', 'Optimization']}}"
94,Explain what information gain and entropy are in the context of a decision tree and walk through a numerical example.,"{'description': 'Understanding fundamental concepts in decision tree machine learning algorithms, focusing on information theory principles used for feature selection and tree construction', 'technical_concepts': {'category': 'Machine Learning', 'primary': ['Information Gain', 'Entropy', 'Decision Tree Learning', 'Feature Selection'], 'tools': [], 'methods': ['ID3 Algorithm', 'CART Algorithm', 'Recursive Feature Selection']}, 'skill_level': {'depth': 'intermediate', 'knowledge_type': ['theoretical', 'implementation'], 'experience_level': 'mid'}, 'domain_context': {'industries': ['Data Science', 'Machine Learning', 'Artificial Intelligence']}}"
95,What is L1 and L2 regularization? What are the differences between the two?,"{'description': 'Understanding regularization techniques in machine learning to prevent overfitting through constraint mechanisms applied to model parameters', 'technical_concepts': {'category': 'Machine Learning', 'primary': ['Regularization', 'Model Complexity Control', 'Parameter Constraint'], 'tools': [], 'methods': ['L1 Regularization (Lasso)', 'L2 Regularization (Ridge)']}, 'skill_level': {'depth': 'intermediate', 'knowledge_type': ['theoretical', 'practical'], 'experience_level': 'mid'}, 'domain_context': {'industries': ['Data Science', 'Machine Learning', 'AI', 'General']}}"
96,Describe gradient descent and the motivations behind stochastic gradient descent.,"{'description': 'Explanation of optimization algorithm used in machine learning to minimize loss functions, with focus on understanding gradient descent and its stochastic variant', 'technical_concepts': {'category': 'Machine Learning', 'primary': ['Optimization Algorithms', 'Loss Function Minimization', 'Iterative Parameter Updating'], 'tools': [], 'methods': ['Gradient Descent', 'Stochastic Gradient Descent', 'Batch Gradient Descent']}, 'skill_level': {'depth': 'intermediate', 'knowledge_type': ['theoretical', 'practical'], 'experience_level': 'mid'}, 'domain_context': {'industries': ['Machine Learning', 'Data Science', 'AI Research']}}"
97,"Assume we have a classifier that produces a score between 0 and 1 for the probability of a particular loan application being fraudulent. Say that for each application's score, we take the square root of that score. How would the ROC curve change? If it doesn't change, what kinds of functions would change the curve?","{'description': 'Analysis of how transformations of a classification probability score impact the Receiver Operating Characteristic (ROC) curve, testing understanding of classification metrics and probability transformations', 'technical_concepts': {'category': 'Statistics', 'primary': ['ROC Curve', 'Classification Probabilities', 'Scoring Transformations', 'Machine Learning Evaluation Metrics'], 'tools': [], 'methods': ['Probability Transformation', 'Score Normalization']}, 'skill_level': {'depth': 'advanced', 'knowledge_type': ['theoretical', 'analytical'], 'experience_level': 'senior'}, 'domain_context': {'industries': ['Financial Services', 'Risk Management', 'Machine Learning']}}"
98,Say X is a univariate Gaussian random variable. What is the entropy of X?,"{'description': 'Evaluating theoretical understanding of entropy in the context of Gaussian probability distributions, testing probabilistic knowledge and statistical information theory concepts', 'technical_concepts': {'category': 'Probability', 'primary': ['Entropy', 'Gaussian Distribution', 'Information Theory', 'Probability Distributions'], 'tools': [], 'methods': ['Gaussian Entropy Calculation', 'Information Entropy Formula']}, 'skill_level': {'depth': 'advanced', 'knowledge_type': ['theoretical', 'mathematical'], 'experience_level': 'senior'}, 'domain_context': {'industries': ['Data Science', 'Machine Learning', 'Statistics', 'General']}}"
99,How would you build a model to calculate a customer's propensity to buy a particular item? What are some pros and cons of your approach?,"{'description': 'Evaluating ability to design a predictive machine learning model for customer purchase behavior, assessing data science and modeling skills', 'technical_concepts': {'category': 'Machine Learning', 'primary': ['Predictive Modeling', 'Customer Purchase Prediction', 'Feature Engineering', 'Model Selection'], 'tools': ['Logistic Regression', 'Decision Trees', 'Random Forest', 'Gradient Boosting'], 'methods': ['Propensity Scoring', 'Classification', 'Probability Estimation']}, 'skill_level': {'depth': 'intermediate', 'knowledge_type': ['theoretical', 'practical', 'implementation'], 'experience_level': 'mid'}, 'domain_context': {'industries': ['E-commerce', 'Retail', 'Marketing Analytics']}}"
